{
  "metadata": {
    "title_slug": "12-sai-lam-content-fanpage-2026",
    "niche": "Chủ fanpage Việt (creator / coach / small business)",
    "topic": "12 sai lầm làm content trên Facebook fanpage khiến reach + engagement thấp",
    "target_audience": "Chủ fanpage Việt dưới 10k follower, đăng đều đặn nhưng reach chạm đáy, chưa ra đơn từ fanpage",
    "product_cta": "[Fanpage Profit Lab] - Chương trình 12 tuần biến fanpage ngủ đông thành kênh ra đơn ổn định",
    "language": "vi",
    "author_name": "[Tên của em]",
    "generated_at": "2026-04-23T00:00:00Z",
    "schema_version": "1.0"
  },
  "cover": {
    "title_full": "12 Sai Lầm Khiến Fanpage Của Em Đăng Mãi Mà Không Ra Đơn",
    "title_highlight_words": ["Sai Lầm"],
    "subtitle": "Những thứ cần dừng ngay trong năm 2026 để fanpage em thoát khỏi trạng thái đăng cho có và bắt đầu nuôi ra khách hàng thật"
  },
  "intro": {
    "hook_title": "Em đăng đều, chỉnh thumbnail đẹp, vậy mà reach vẫn chạm đáy?",
    "body_paragraphs": [
      "Em dậy sớm lên bài, chỉnh ảnh 30 phút, caption chỉn chu. Ba ngày sau kiểm tra: 50 reach, 2 like từ bạn bè, DM im lặng. Em tự hỏi mình đã thiếu cái gì, trong khi đối thủ đăng 1 post 'xấu hơn' lại có 500 tương tác.",
      "Sự thật là thuật toán Facebook 2026 không còn chơi theo luật 2020. Em vẫn đang làm bài cho một phiên bản Facebook không còn tồn tại. Nếu em không sửa 12 sai lầm dưới đây, mọi cố gắng chỉ đang nuôi thuật toán, không phải nuôi sự nghiệp của em."
    ],
    "cta_line": "đây là 12 điều em cần dừng ngay:",
    "cta_summary": "12 thói quen đang ngầm giết fanpage của em, và cách thoát khỏi từng cái một."
  },
  "items": [
    {
      "number": 1,
      "heading": "Đừng coi fanpage chỉ là kênh bán hàng.",
      "body_paragraphs": [
        "Em đăng 10 bài thì 9 bài là 'sản phẩm mới, giá ưu đãi, inbox để tư vấn'. Giống như em đang hét vào loa trong một buổi tiệc, ai cũng khó chịu và không ai muốn nghe. Thuật toán 2026 đã học được điều đó và âm thầm giảm reach của em mỗi ngày.",
        "Công thức đổi: 10 bài thì 2 bài bán, 5 bài giá trị thực (bí quyết, câu chuyện nghề, hậu trường), 3 bài tương tác (câu hỏi, poll, minigame). Đây là tỷ lệ người theo dõi thật sự tưởng thưởng, và là tỷ lệ thuật toán thấy page này đáng hiển thị."
      ],
      "research_source": "ohimarketingfanpage FB + advertisingvietnam.com"
    },
    {
      "number": 2,
      "heading": "Đừng bỏ câu hook 3 giây đầu.",
      "body_paragraphs": [
        "Người lướt newsfeed quyết định đọc tiếp hay lướt qua trong 3 giây. Em mở bài bằng 'Chào cả nhà, hôm nay shop có...' nghĩa là em vừa tự tặng post của mình cho thuật toán để giấu đi. Không ai dừng lại để đọc một lời chào.",
        "Mở bằng câu hỏi chạm nỗi đau, con số gây sốc, hoặc lời thú nhận thật. 'Tôi đã đốt 3 triệu tiền quảng cáo trong 1 ngày vì sai lầm này.' Hoặc: '99% chủ shop đang làm điều này sai.' Hook giữ mắt, reach mới đến."
      ],
      "research_source": "TomorrowMarketers FB + tinhte.vn"
    },
    {
      "number": 3,
      "heading": "Đừng viết cho 'tất cả mọi người'.",
      "body_paragraphs": [
        "Em viết 'dành cho các bạn quan tâm đến sức khỏe', nghe rộng cho an toàn. Nhưng đó chính là lý do không ai cảm thấy post này nói riêng với họ. Kết quả: không ai lưu, không ai chia sẻ, không ai nhắn tin.",
        "Viết cho 1 người cụ thể có tên có tuổi. 'Chị Lan, 35 tuổi, mẹ hai bé, hay đau lưng vì bế con cả ngày.' Càng hẹp càng sắc, và người đúng sẽ tự nhận ra chính mình, tự chạm tim, tự nhắn tin cho em."
      ],
      "research_source": "Greatness Tribe FB + Sprout Social"
    },
    {
      "number": 4,
      "heading": "Đừng đuổi theo like, hãy đuổi theo share.",
      "body_paragraphs": [
        "Like là cảm xúc nửa giây rồi quên. Share là người đó đặt uy tín của mình lên post của em trước mặt bạn bè họ. Thuật toán 2026 biết rõ điều đó. Một lượt chia sẻ bằng hai mươi like về mặt reach, đây không phải đồn thổi.",
        "Mỗi post trước khi đăng, tự hỏi: 'Người đọc có muốn gửi cái này cho ai không?' Nếu câu trả lời là không, viết lại. Post được chia sẻ là post cho người ta góc nhìn mới, câu để tranh luận, hoặc thứ hữu ích cụ thể."
      ],
      "research_source": "dilaintechs FB + SocialBee 2026"
    },
    {
      "number": 5,
      "heading": "Đừng đăng ảnh tĩnh khi đối thủ đã làm video.",
      "body_paragraphs": [
        "Thuật toán Facebook 2026 đang đẩy Reels mạnh, không phải vì Facebook thích Reels mà vì người dùng ở lại lâu hơn. Em vẫn đăng 100% ảnh tĩnh trong khi đối thủ đăng video? Em đang thi chạy với một chân bị trói.",
        "Không cần trở thành nhà sáng tạo chuyên nghiệp. Bắt đầu với 1 video 15 giây mỗi tuần, quay bằng điện thoại, nói thẳng vào camera về một điều em biết sâu. Đơn giản, thô, nhưng em đã bước vào cuộc chơi thuật toán đang ưu ái."
      ],
      "research_source": "NovaBeyond + EuroShub"
    },
    {
      "number": 6,
      "heading": "Đừng đăng rồi biến mất trong giờ đầu.",
      "body_paragraphs": [
        "Em bấm đăng, tắt Facebook, đi làm việc khác. Thuật toán đang ở ngay đó, thử post của em với 100 người đầu tiên. Không có bình luận, không có chia sẻ, không có lưu trong sáu mươi phút? Post đi vào nghĩa địa, không ai thấy nữa.",
        "Lên lịch đăng chỉ khi em sẵn sàng ngồi lại 60 phút. Trả lời bình luận đầu trong 5 phút. Gieo một câu hỏi ở cuối post. Tương tác sớm nói với thuật toán đây là bài chất, và nó mở rộng phân phối cho em."
      ],
      "research_source": "SocialBee 2026 early engagement window"
    },
    {
      "number": 7,
      "heading": "Đừng làm bài quá bóng bẩy.",
      "body_paragraphs": [
        "Em thuê nhà thiết kế, chỉnh từng pixel, chụp ảnh studio, rồi không hiểu sao post không có tương tác. Người xem năm 2026 đã chán 'doanh nghiệp nói chuyện với doanh nghiệp'. Họ muốn thấy người thật, cảm xúc thật, câu chuyện thật.",
        "Thử một post quay bằng điện thoại, không trang điểm, nói về một sai lầm em vừa mắc tuần này. Tương tác sẽ cao gấp năm đến mười lần so với post studio đẹp. Chân thật năm 2026 không phải lựa chọn nữa, nó là điều kiện sống."
      ],
      "research_source": "ShortVids + Distribution.ai 2026"
    },
    {
      "number": 8,
      "heading": "Đừng đăng tuỳ hứng, không chủ đề cột.",
      "body_paragraphs": [
        "Thứ 2 em đăng bí quyết dưỡng da. Thứ 3 meme vui. Thứ 4 review quán ăn. Em nghĩ 'đa dạng để ai cũng vào', nhưng thuật toán không biết gợi ý page em cho ai. Kết quả: không gợi ý cho ai cả.",
        "Chọn đúng 3 chủ đề cột, chỉ 3. Ví dụ: 'chăm da dầu', 'review mỹ phẩm giá rẻ', 'nếp sinh hoạt hàng ngày'. Mọi post phải rơi vào một trong ba. Nhất quán sâu, không đa dạng lỏng, đó là luật sống còn của fanpage 2026."
      ],
      "research_source": "Women Entrepreneurs FB + hocvienmarketingaau"
    },
    {
      "number": 9,
      "heading": "Đừng chạy theo mọi trend viral.",
      "body_paragraphs": [
        "Trend 'nhảy điệu con gà' đang viral, em cũng nhảy? Em bán khoá học nhưng lại đang múa trên camera. Người theo dõi nhìn em lạ lẫm, không còn biết fanpage này về cái gì nữa. Trend sai làm em mất định vị còn nhanh hơn không đăng.",
        "Lọc mọi trend qua một câu hỏi duy nhất: 'Trend này giúp khách lý tưởng của em giải quyết vấn đề gì?' Nếu không, bỏ qua, dù nó có mười triệu lượt xem. Định vị rõ quan trọng hơn một nghìn lần so với view ngắn hạn."
      ],
      "research_source": "SocialBee repeatable formats + user memory"
    },
    {
      "number": 10,
      "heading": "Đừng đánh giá fanpage bằng số người theo dõi.",
      "body_paragraphs": [
        "Mười nghìn người theo dõi mà mỗi post chỉ có 5 tương tác là dấu hiệu fanpage đang chết, không phải đang sống. Tỷ lệ tương tác trên reach mới là con số thật. Số người theo dõi chỉ làm ego vui mỗi tối, nhưng không trả tiền điện và tiền chợ.",
        "Theo dõi 3 con số mỗi tuần: tỷ lệ tương tác trên reach, tỷ lệ lưu bài trên reach, và số cuộc hội thoại trong hộp tin nhắn. Ba con số này nói sự thật về sức khoẻ fanpage. Số người theo dõi thì không, nó là khói."
      ],
      "research_source": "Distribution.ai vanity + BrandsVietnam"
    },
    {
      "number": 11,
      "heading": "Đừng đăng nhiều, hãy đăng đúng.",
      "body_paragraphs": [
        "Em đăng 3 bài mỗi ngày để 'nuôi thuật toán'. Nhưng mỗi bài chỉ có 30 reach và 1 like, nghĩa là em đang tự huấn luyện thuật toán rằng post của em không đáng hiển thị. Tần suất sai giết reach nhanh hơn cả việc không đăng gì.",
        "Ba đến bốn bài chất trong một tuần đánh bại 21 bài nhạt. Mỗi bài phải qua bài kiểm tra: 'Có ít nhất một lý do rõ để người ta dừng lướt ở đây không?' Nếu câu trả lời mập mờ, đừng đăng, tiết kiệm tên tuổi em."
      ],
      "research_source": "Glints + EQVN + advertisingvietnam.com"
    },
    {
      "number": 12,
      "heading": "Đừng bỏ fanpage trước 90 ngày.",
      "body_paragraphs": [
        "Em đăng được 30 bài, không thấy kết quả, bắt đầu nản và đổi sang TikTok. Đây chính là cái bẫy giết 90% fanpage trước tuổi trưởng thành. Thuật toán 2026 cần 60 đến 90 ngày để học page em thuộc về ai, đề xuất cho ai.",
        "Cam kết 90 ngày: 4 bài chất mỗi tuần, nhất quán chủ đề cột, đo số vào mỗi cuối tuần. Không đổi định dạng mỗi 3 ngày. Hạt giống cần thời gian dưới lòng đất. Sau 90 ngày em có dữ liệu thật để quyết định tiếp, không phải đoán mò."
      ],
      "research_source": "Greatness Tribe consistency + SocialBee repeatable formats"
    }
  ],
  "offer_page": {
    "header": "Vậy, từ đâu bắt đầu?",
    "title": "Lộ Trình 90 Ngày Biến Fanpage Của Em Thành Cỗ Máy Ra Đơn",
    "title_highlight_words": ["Lộ Trình"],
    "description": "Không chỉ dừng 12 sai lầm, em cần hệ thống thay thế: chủ đề cột đúng, lịch đăng 90 ngày, thư viện hook đã test thực chiến. Đó là Fanpage Profit Lab: 12 tuần từ fanpage ngủ đông sang fanpage ra đơn đầu tiên, với framework em làm theo được ngay.",
    "benefits": [
      {
        "emoji": "📈",
        "title": "Reach tự nhiên",